{
  "pm_id": "PM-3.6",
  "run_id": "DIESEL-2026-04-18",
  "guide": "Guía 1.1 — The Workshop Specialist",
  "generated_at": "2026-04-17",
  "model": "claude-sonnet-4-6",
  "status": "completed",
  "version": "3.0",
  "note": "Complete rewrite v3 — bilingual (EN/ES), student-facing, PM-3.2 depth, V+O+C + step-by-step + entregable per activity.",
  "document_title": "Guía de Aprendizaje No 1.1 — The Workshop Specialist",
  "gfpi_ref": "GFPI-F-135",
  "section1_identificacion": {
    "programa_formacion": "Mantenimiento de los Motores Diesel",
    "codigo_programa": "220501096",
    "version_programa": "1",
    "nombre_proyecto": "The Diesel Workshop — Comunicación Técnica en Inglés A1.1",
    "fase_proyecto": "Análisis — Apropiación — Transferencia",
    "actividad_proyecto": "Comunicar información técnica básica del taller de motores diesel en inglés (A1.1–A1.2)",
    "competencia": "Comunicar información técnica en inglés en contextos de mantenimiento de motores",
    "rap_code": "220501096",
    "rap_descripcion": "Comunicar información técnica en inglés en contextos de mantenimiento de motores",
    "duracion_guia": "60 horas (48.75 h directas + 11.25 h autónomas) — 8 sesiones × 6 h",
    "ambiente_formacion": "Aula de formación con acceso a taller de motores diesel (Bay 1, Bay 2, Bay 3)",
    "material_formacion": "Worksheets PM-2.1 a PM-2.10 · Word Wall 20 términos · Stock Cards A/B · Chunk Cards · Communication Card S5 · Cuestionario No 6 · Escala de Estimación No 4, 5 y 6",
    "fecha_elaboracion": "Abril 2026",
    "elaboro": "FPI SENA Factory / LG Engine v2.0"
  },
  "section2_presentacion": "Bienvenido a The Diesel Workshop. Durante las próximas ocho sesiones, vas a recorrer un itinerario de aprendizaje diseñado para que puedas comunicarte en inglés técnico dentro de un taller real de mantenimiento de motores diesel. El escenario es Bay 2: aquí trabajan Carlos Mendoza (técnico líder), Valentina Cruz (aprendiz) y Santiago Ríos (técnico de apoyo). Tu misión es aprender a leer documentos técnicos, escribir órdenes de trabajo e informes de inspección, escuchar y entender un briefing de seguridad, y hablar con confianza usando las cinco funciones comunicativas del taller. El nivel de referencia es CEFR A1.1–A1.2. Las primeras dos sesiones activan tu conocimiento previo y construyen tu vocabulario base (20 términos del Toolbelt). Las sesiones 3 a 6 desarrollan comprensión lectora, escritura técnica, comprensión auditiva, producción oral y funciones comunicativas integradas. Las sesiones 7 y 8 son la preparación y ejecución de la Misión Final: un Workshop Morning Readiness Briefing completo de 3 a 4 minutos, en equipo de tres, ante el Coordinador de Formación. Al final de esta guía habrás demostrado que Bay 2 está operativa y que puedes comunicarte en inglés en un entorno real de mantenimiento.",
  "section3_actividades": {
    "3_1_reflexion": {
      "titulo": "3.1 Actividad de Reflexión Inicial — Análisis",
      "sesiones": "S1–S2 · ~12 horas",
      "descripcion": "Activar el conocimiento previo, mapear el vocabulario técnico del taller, establecer la comunidad de aprendizaje y anclar visualmente los 20 términos del Toolbelt.",
      "actividades": [
        {
          "id": "A1",
          "nombre_en": "The Headline — Safety Awareness",
          "nombre_es": "El Titular — Conciencia de Seguridad",
          "sesion": "S1",
          "materiales": [
            "PM-2.1 Actividad 1",
            "Post-its",
            "Marcador"
          ],
          "dimensiones": [
            {
              "tipo": "COGNITIVA",
              "label": "COGNITIVA — Saber",
              "en": "Identify the safety problem described in the headline 'Three mechanics hospitalized after workshop fire' and relate it to possible causes of an incident in a diesel workshop.",
              "es": "Identificar el problema de seguridad descrito en el titular 'Three mechanics hospitalized after workshop fire' y relacionarlo con las causas posibles de un incidente en un taller diesel."
            },
            {
              "tipo": "ACTITUDINAL",
              "label": "ACTITUDINAL — Ser",
              "en": "Reflect on the importance of complying with safety rules as a professional responsibility of the diesel maintenance technician.",
              "es": "Reflexionar sobre la importancia del cumplimiento de las normas de seguridad como responsabilidad profesional del técnico en mantenimiento de motores diesel."
            }
          ],
          "pasos": [
            {
              "en": "Estudiantes repiten en voz baja (mumbling rehearsal) — pronunciación de palabras clave: 'mechanics', 'hospitalized', 'fire'.",
              "es": "Estudiantes repiten en voz baja (mumbling rehearsal) — pronunciación de palabras clave: 'mechanics', 'hospitalized', 'fire'."
            },
            {
              "en": "Formar grupos de 3-4 (preformada si es posible — heterogénea).",
              "es": "Formar grupos de 3-4 (preformada si es posible — heterogénea)."
            },
            {
              "en": "Distribuir cartel de preguntas (impreso o en pizarra): '(1) What happened? (2) Why? (3) What is PPE? (4) What should they do?'",
              "es": "Distribuir cartel de preguntas (impreso o en pizarra): '(1) What happened? (2) Why? (3) What is PPE? (4) What should they do?'"
            },
            {
              "en": "Grupos discuten en inglés 5-8 min; anotan IDEAS en post-its (máximo 3 palabras c/u, inglés si es posible).",
              "es": "Grupos discuten en inglés 5-8 min; anotan IDEAS en post-its (máximo 3 palabras c/u, inglés si es posible)."
            },
            {
              "en": "Grupos publican post-its en mural de pared (Safety Wall — permanece toda S1).",
              "es": "Grupos publican post-its en mural de pared (Safety Wall — permanece toda S1)."
            }
          ],
          "entregable": {
            "producto": "Post-its con respuestas al cartel de preguntas + PM-2.1 Actividad 1 completada",
            "formato": "Post-its físicos en el Safety Wall + hoja impresa PM-2.1",
            "criterio_minimo": "Mínimo una respuesta por pregunta: ¿Qué pasó? / ¿Por qué ocurrió? / ¿Qué es PPE?"
          }
        },
        {
          "id": "A2",
          "nombre_en": "The Map — Workshop Geography",
          "nombre_es": "El Mapa — Geografía del Taller",
          "sesion": "S1",
          "materiales": [
            "PM-2.1 Actividad 2",
            "Infografía del taller (proyectada)"
          ],
          "dimensiones": [
            {
              "tipo": "COGNITIVA",
              "label": "COGNITIVA — Saber",
              "en": "Identify and name in English the seven areas of the diesel workshop (Service Bay, Parts Room, Tool Storage, Wash Area, Hazmat Zone, Reception, Office) using the workshop layout infographic.",
              "es": "Identificar y nombrar en inglés las siete áreas del taller de motores diesel a partir de la infografía del taller proyectada en clase."
            },
            {
              "tipo": "PROCEDIMENTAL",
              "label": "PROCEDIMENTAL — Hacer",
              "en": "Describe the location of one assigned workshop area using the sentence pattern: 'This is the ___. The ___ is next to the ___.' and present it to the class.",
              "es": "Describir la ubicación del área asignada del taller usando el modelo: 'This is the ___. The ___ is next to the ___.' y presentarla al grupo."
            }
          ],
          "pasos": [
            {
              "en": "Estudiantes repiten en coro 2 veces cada zona.",
              "es": "Estudiantes repiten en coro 2 veces cada zona."
            },
            {
              "en": "Parejas (pre-asignadas, cambiadas de A): una pareja recibe zona 1, otra zona 2, etc. (7 zonas = 4 pares + 1 trio, rotate).",
              "es": "Parejas (pre-asignadas, cambiadas de A): una pareja recibe zona 1, otra zona 2, etc. (7 zonas = 4 pares + 1 trio, rotate)."
            },
            {
              "en": "Cada pareja prepara 2 oraciones descripción (escriben en papel o tablet — 5 min).",
              "es": "Cada pareja prepara 2 oraciones descripción (escriben en papel o tablet — 5 min)."
            },
            {
              "en": "Parejas presentan al plenary (15 seg c/u).",
              "es": "Parejas presentan al plenary (15 seg c/u)."
            },
            {
              "en": "Crear Word Wall en pared: 7 tarjetas con ÁREAS (escritas por instructor en grande) permanecen visibles.",
              "es": "Crear Word Wall en pared: 7 tarjetas con ÁREAS (escritas por instructor en grande) permanecen visibles."
            }
          ],
          "entregable": {
            "producto": "Dos oraciones escritas describiendo el área asignada + PM-2.1 Actividad 2 completada",
            "formato": "Hoja impresa PM-2.1",
            "criterio_minimo": "Dos oraciones completas usando el modelo de ubicación. Área correctamente identificada y descrita."
          }
        },
        {
          "id": "A3",
          "nombre_en": "The Story & The Debate — Characters and Values",
          "nombre_es": "La Historia y el Debate — Personajes y Valores",
          "sesion": "S1",
          "materiales": [
            "PM-2.1 Actividades 3-4",
            "PM-2.2 Contextualización",
            "Tarjetas verdes/rojas para votación"
          ],
          "dimensiones": [
            {
              "tipo": "COGNITIVA",
              "label": "COGNITIVA — Saber",
              "en": "Relate the three workshop characters (Carlos Mendoza — Lead Technician, Valentina Cruz — Apprentice, Santiago Ríos — Technician) to their professional roles in a diesel workshop context.",
              "es": "Relacionar los tres personajes del taller (Carlos Mendoza — técnico líder, Valentina Cruz — aprendiz, Santiago Ríos — técnico) con sus roles profesionales en el contexto real de un taller diesel."